{
  "$schema": "https://recursive-dev-loop.dev/schemas/stored-feedback-record.v1.schema.json",
  "storage_version": "1.0.0",
  "record_id": "fb-g0g1-wiring-20260830",
  "ingested_at": "2026-08-30T22:09:50.060Z",
  "source": {
    "display_path": ".dal/outbox/fb-g0g1-wiring-20260830.json",
    "sha256": "2876ea49f27e648220861a7975d483148c5637f7142c5a78d88ed7963695a42b"
  },
  "feedback_sha256": "e9b9c411623784fec5f7a6b2c035323772ec753fe6dc24a2bae23b43f7d0bc01",
  "privacy_scan": {
    "ruleset_version": "secret-ruleset-2026-08-27-v1",
    "pii_ruleset_version": "pii-ruleset-2026-08-27-v1",
    "status": "passed",
    "scanned_at": "2026-08-30T22:09:50.060Z",
    "matched_rules": []
  },
  "feedback": {
    "$schema": "https://recursive-dev-loop.dev/schemas/feedback-log.v1.schema.json",
    "schema_version": "1.0.0",
    "feedback_id": "fb-g0g1-wiring-20260830",
    "change_id": "chg-g0g1-wiring",
    "created_at": "2026-08-30T22:09:47.000Z",
    "supersedes": null,
    "producer": {
      "actor": {
        "kind": "automation",
        "id": "dsh-agent"
      },
      "harness": {
        "name": "dsh",
        "version": null,
        "session_id": null
      },
      "repository": {
        "root": "repo://dsh-adaptive-loop",
        "revision": "7f3cf0ddec0bc96a97466cb22023fa2206433fdb",
        "branch": "improvements/audit-borrows",
        "dirty": true
      },
      "task_ref": null
    },
    "goal": "Wire the G0/G1 demo substrate: tools-based e2e runs over the mock service, unknown-outcome resolution, execution-receipt production, the G0 skill with a deliberate gap, and the demo image with the workflow tools baked.",
    "acceptance_criteria": [
      {
        "id": "ac-service-resolution",
        "statement": "Unknown effects resolve on status query (success re-applies once, idempotent thereafter); 6 service tests pass.",
        "result": "passed",
        "evidence": [
          "ev-tests"
        ]
      },
      {
        "id": "ac-driver",
        "statement": "The e2e driver seeds the service, mounts the tools via the composition patch, grades the projected service state, and emits an execution receipt with the full digest chain per run.",
        "result": "passed",
        "evidence": [
          "ev-driver"
        ]
      },
      {
        "id": "ac-skill",
        "statement": "The G0 skill is tools-based with a deliberate unknown-outcome gap; guard tests assert the gap and the oracle-free wording.",
        "result": "passed",
        "evidence": [
          "ev-tests"
        ]
      },
      {
        "id": "ac-image",
        "statement": "The demo image bakes the workflow-tools plugin and the loader resolves it from the install anchor.",
        "result": "passed",
        "evidence": [
          "ev-image"
        ]
      },
      {
        "id": "ac-gate",
        "statement": "The full gate passes on the branch.",
        "result": "passed",
        "evidence": [
          "ev-gate"
        ]
      }
    ],
    "outcome": {
      "status": "completed",
      "summary": "Demo substrate wired: service with resolution semantics, receipts per run, tools-based G0 skill with a guarded gap, and the demo image — ready for the G0/G1 model runs.",
      "exception": null
    },
    "what_worked": [
      "The receipt chain falls out of the driver naturally: skill digest as candidate, composition digest from patch+skill, before/after digests from the seeded and graded service state.",
      "The G0 gap (no unknown-outcome guidance) is itself regression-guarded, so the G1 promotion will have a falsifiable target."
    ],
    "what_failed": [],
    "calls": [
      {
        "sequence": 1,
        "kind": "tool",
        "name": "demo-wiring",
        "purpose": "Extend the service with unknown resolution, rewrite the driver for tools and receipts, write the G0 skill, bake the plugin into the demo image.",
        "outcome": "succeeded",
        "duration_ms": null,
        "evidence": [
          "ev-tests",
          "ev-driver",
          "ev-image"
        ]
      },
      {
        "sequence": 2,
        "kind": "tool",
        "name": "pnpm-check",
        "purpose": "Run the full repository verification gate.",
        "outcome": "succeeded",
        "duration_ms": null,
        "evidence": [
          "ev-gate"
        ]
      }
    ],
    "failures_and_inefficiencies": [],
    "evidence": [
      {
        "id": "ev-tests",
        "kind": "test",
        "uri": "repo://tests/workflow-tools.test.ts",
        "summary": "Six service tests including unknown-resolution idempotency, plus the G0 gap guard and updated oracle guards.",
        "sha256": null,
        "observed_at": "2026-08-30T22:09:47.000Z"
      },
      {
        "id": "ev-driver",
        "kind": "file",
        "uri": "repo://benchmarks/tau-style-workflow/run-e2e.ts",
        "summary": "Tools-based driver: service seeding, composition patch, service-state grading, execution receipts under .dal/check/e2e-receipts.",
        "sha256": null,
        "observed_at": "2026-08-30T22:09:47.000Z"
      },
      {
        "id": "ev-image",
        "kind": "command",
        "uri": "command://docker-build-demo-image",
        "summary": "dsh-adaptive-loop/dsh:0.1.1-rc.2-demo built; dal-workflow-tools resolves from the dsh install anchor inside the container.",
        "sha256": null,
        "observed_at": "2026-08-30T22:09:47.000Z"
      },
      {
        "id": "ev-gate",
        "kind": "test",
        "uri": "command://pnpm-run-check",
        "summary": "Typecheck, build, 152 tests, capsule checks, policy check, v0 suite, and benchmark suite all passed on improvements/audit-borrows.",
        "sha256": null,
        "observed_at": "2026-08-30T22:09:47.000Z"
      }
    ],
    "uncertainty": [],
    "human_review": {
      "status": "not_required",
      "reviewer": null,
      "reviewed_at": null,
      "notes": [
        "Deterministic wiring only; the model runs themselves await explicit approval decisions in the demo round."
      ],
      "approval_refs": []
    },
    "privacy": {
      "classification": "internal",
      "retention": "local-only",
      "tags": [
        "no-secrets",
        "feature"
      ],
      "contains_personal_data": false,
      "redactions": []
    }
  }
}
